{"schemaVersion":1,"collectorVersion":"0.1.0","generatedAt":"2026-09-29T15:23:51.971Z","errors":[],"source":"teamclaude","observedAt":"2026-09-29T15:23:51.970Z","ageSeconds":0,"stale":false,"fiveHour":{"usedPercentage":4,"resetsAt":"2026-09-29T18:09:59.700Z"},"weekly":{"usedPercentage":42.3,"resetsAt":"2026-10-01T03:59:59.583Z"},"accounts":[{"fiveHour":{"usedPercentage":0,"resetsAt":"2026-09-29T19:29:59.583Z"},"weekly":{"usedPercentage":98,"resetsAt":"2026-10-01T03:59:59.583Z"}},{"fiveHour":{"usedPercentage":0,"resetsAt":"2026-09-29T18:09:59.700Z"},"weekly":{"usedPercentage":20,"resetsAt":"2026-10-02T18:59:59.700Z"}},{"fiveHour":{"usedPercentage":12,"resetsAt":"2026-09-29T20:10:00.000Z"},"weekly":{"usedPercentage":9,"resetsAt":"2026-10-06T13:00:00.000Z"}}],"claudeCodeVersion":null}